4 Consider the schema for College Database: 
STUDENT(USN, SName, Address, Phone, Gender)
 SEMSEC(SSID, Sem, Sec) 
CLASS(USN, SSID) 
SUBJECT(Subcode, Title, Sem, Credits)
 IAMARKS(USN, Subcode, SSID, Test1, Test2, Test3, FinalIA) 

Write SQL queries to
 1. List all the student details studying in fourth semester ‘C’ section. 
2. Compute the total number of male and female students in each semester and in each section. 
3. Create a view of Test1 marks of student USN ‘1BI15CS101’ in all subjects.
 4. Calculate the FinalIA (average of best two test marks) and update the corresponding table for all students.
 5. Categorize students based on the following criterion: If FinalIA = 17 to 20 then CAT = ‘Outstanding’
 If FinalIA = 12 to 16 then CAT = ‘Average’
 If FinalIA< 12 then CAT = ‘Weak’ Give these details only for 8th semester A, B, and C section students.



 SQL>create table student(usn varchar(11) primary key,
 Sname varchar(20) not null,address varchar(30),
 phone number(10),gender varchar(6));

Table created.

SQL> desc student;
 Name                                      Null?    Type
 ----------------------------------------- -------- -----------------
 USN                                       NOT NULL VARCHAR2(11)
 SNAME                                     NOT NULL VARCHAR2(20)
 ADDRESS                                            VARCHAR2(30)
 PHONE                                              NUMBER(10)
 GENDER                                             VARCHAR2(6)

SQL> create table semsec(ssid varchar(5) primary key,
    sem int,sec varchar(5));

Table created.

SQL> desc semsec;
 Name                                      Null?    Type
 ----------------------------------------- -------- ------------
 SSID                                      NOT NULL VARCHAR2(5)
 SEM                                                NUMBER(38)
 SEC                                                VARCHAR2(5)

SQL>  create table clas(usn varchar(11) references student(usn),
     ssid varchar(5) references semsec(ssid),
     primary key(usn,ssid));

Table created.

SQL> desc clas;
 Name                                      Null?    Type
 ----------------------------------------- -------- -----------------
 USN                                       NOT NULL VARCHAR2(11)
 SSID                                      NOT NULL VARCHAR2(5)

SQL> create table subject(subcode varchar(7) primary key,
     title varchar(10),
     sem int,credits float);

Table created.

SQL> desc subject;
 Name                                      Null?    Type
 ----------------------------------------- -------- ----------------
 SUBCODE                                   NOT NULL VARCHAR2(7)
 TITLE                                              VARCHAR2(10)
 SEM                                                NUMBER(38)
 CREDITS                                            FLOAT(126)


SQL> create table iamarks(usn varchar(11) references student(usn),
     subcode varchar(7) references subject(subcode),
     ssid varchar(5) references semsec(ssid),
     test1 number(6,3),
     test2 number(6,3),
     test3 number(6,3),
     finalIA number(6,3));

Table created.

SQL> desc iamarks;
 Name                                      Null?    Type
 ----------------------------------------- -------- ---------------------------
 USN                                                VARCHAR2(11)
 SUBCODE                                            VARCHAR2(7)
 SSID                                               VARCHAR2(5)
 TEST1                                              NUMBER(6,3)
 TEST2                                              NUMBER(6,3)
 TEST3                                              NUMBER(6,3)
 FINALIA                                            NUMBER(6,3)

SQL> insert into STUDENT values('&usn','&sname','&address',&phone,'&gender');

SQL> select *from student;

USN         SNAME                ADDRESS                             PHONE GENDER
----------- -------------------- ------------------------------ ---------- ------
1va12cs001  anwar                blore                          9845611111 male
1va12cs002  bharath              mysore                         9845611112 male
1va12cs003  chaithra             hubli                          9845611113 female
1va13cs004  daniel               blore                          9845611114 male
1bi15cs101  rajesh               pune                           9845611115 male
1bi15cs102  gayathri             blore                          9845611116 female

6 rows selected.

SQL> insert into semsec values('&ssid',&sem,'&sec');

SQL> select *from semsec;

SSID         SEM SEC
----- ---------- -----
s1             4 c
s2             8 a
s3             8 b
s4             8 c
s5             5 a
s6             5 b
s7             4 b
s8             4 a

8 rows selected.

SQL>insert into clas  values('&usn','&ssid');

SQL> select *from clas;

USN         SSID
----------- -----
1bi15cs101  s5
1bi15cs102  s3
1va12cs001  s1
1va12cs002  s2
1va12cs003  s3
1va13cs004  s4

6 rows selected.

SQL> insert into subject values('&subcode','&title',&sem,&credits);

SQL> select *from subject;

SUBCODE TITLE             SEM    CREDITS
------- ---------- ---------- ----------
10cs51  me                  5          4
10cs52  dbms                5          4
10cs81  aca                 8          3
10cs82  nm                  8          3
10cs83  dos                 8          3
10cs41  ada                 4          4
10cs42  c++                 4          4

7 rows selected.


SQL> alter table iamarks drop column finalIa;

Table altered.

SQL> desc iamarks;
 Name                                      Null?    Type
 ----------------------------------------- -------- ---------------------------
 USN                                                VARCHAR2(11)
 SUBCODE                                            VARCHAR2(7)
 SSID                                               VARCHAR2(5)
 TEST1                                              NUMBER(6,3)
 TEST2                                              NUMBER(6,3)
 TEST3                                              NUMBER(6,3)

SQL> insert into iamarks values('&usn','&subcode','&ssid',&test1,&test2,&test3);

SQL> select *from iamarks;

USN         SUBCODE SSID       TEST1      TEST2      TEST3    FINALIA
----------- ------- ----- ---------- ---------- ---------- ----------
1va12cs001  10cs41  s7            11         15         18
1va12cs001  10cs42  s6            13         19         12
1bi15cs101  10cs51  s5            19         20         12
1bi15cs101  10cs52  s5            12         14         16
1va12cs002  10cs81  s2            16         17         18
1va12cs002  10cs82  s2            12         16         15
1va12cs002  10cs83  s2            16         18         20
1va12cs003  10cs81  s3            14         12         11
1va12cs003  10cs82  s3            12         11         16
1va12cs003  10cs83  s3            18         12         10
1va13cs004  10cs81  s4            16         12         11

USN         SUBCODE SSID       TEST1      TEST2      TEST3    FINALIA
----------- ------- ----- ---------- ---------- ---------- ----------
1va13cs004  10cs82  s4            16         17         18

12 rows selected.


SQL> alter table iamarks add finalia number(6,3);


Write SQL queries to 

1. List all the student details studying in fourth semester ‘C’ section.


SQL> select s.usn,s.sname,s.address,s.phone,s.gender,u.sem,u.sec
     from student s,clas c ,semsec u
     where s.usn=c.usn and u.ssid=c.ssid and u.sem=4 and u.sec='c';

USN         SNAME                ADDRESS                             PHONE GENDER        SEM SEC
----------- -------------------- ------------------------------ ---------- ------ ---------- -----
1va12cs001  anwar                blore                          9845611111 male            4 c


2. Compute the total number of male and female students in each semester and in each section. 

SQL> select u.sem,u.sec,s.gender,count(*)
     from student s,semsec u,clas c
     where s.usn=c.usn and c.ssid=u.ssid
     group by u.sem,u.sec,s.gender;

       SEM SEC   GENDER   COUNT(*)
---------- ----- ------ ----------
         4 c     male            1
         8 a     male            1
         8 c     male            1
         5 a     male            1
         8 b     female          2

3. Create a view of Test1 marks of student USN ‘1BI15CS101’ in all subjects. 

SQL> create view TEST1_MARKS_OF_1bi15cs101(usn,name,subcode,title,test1_marks)
     as select s.usn,s.sname,i.subcode,sub.title,i.test1
     from student s,iamarks i,subject sub
     where s.usn=i.usn and i.subcode=sub.subcode and s.usn='1bi15cs101';

View created.

SQL> select *from TEST1_MARKS_OF_1bi15cs101;

USN         NAME                 SUBCODE TITLE      TEST1_MARKS
----------- -------------------- ------- ---------- -----------
1bi15cs101  rajesh               10cs51  me                  19
1bi15cs101  rajesh               10cs52  dbms                12


4. Calculate the FinalIA (average of best two test marks) and 
update the corresponding table for all students. 

Before updating finalia marks of all students

SQL> select *from iamarks;

USN         SUBCODE SSID       TEST1      TEST2      TEST3    FINALIA
----------- ------- ----- ---------- ---------- ---------- ----------
1va12cs001  10cs41  s7            11         15         18
1va12cs001  10cs42  s6            13         19         12
1bi15cs101  10cs51  s5            19         20         12
1bi15cs101  10cs52  s5            12         14         16
1va12cs002  10cs81  s2            16         17         18
1va12cs002  10cs82  s2            12         16         15
1va12cs002  10cs83  s2            16         18         20
1va12cs003  10cs81  s3            14         12         11
1va12cs003  10cs82  s3            12         11         16
1va12cs003  10cs83  s3            18         12         10
1va13cs004  10cs81  s4            16         12         11

USN         SUBCODE SSID       TEST1      TEST2      TEST3    FINALIA
----------- ------- ----- ---------- ---------- ---------- ----------
1va13cs004  10cs82  s4            16         17         18

12 rows selected.

query to update finalia marks of all the students;

SQL> update iamarks
     set finalia=case
     when (test1<test2 and test1<test3) then ceil((test2+test3)/2)
     when (test2<test1 and test2<test3) then ceil((test1+test3)/2)
     else ceil((test1+test2)/2)
     end;

12 rows updated.

After updating finalia marks of all students

SQL> select *from iamarks;

USN         SUBCODE SSID       TEST1      TEST2      TEST3    FINALIA
----------- ------- ----- ---------- ---------- ---------- ----------
1va12cs001  10cs41  s7            11         15         18         17
1va12cs001  10cs42  s6            13         19         12         16
1bi15cs101  10cs51  s5            19         20         12         20
1bi15cs101  10cs52  s5            12         14         16         15
1va12cs002  10cs81  s2            16         17         18         18
1va12cs002  10cs82  s2            12         16         15         16
1va12cs002  10cs83  s2            16         18         20         19
1va12cs003  10cs81  s3            14         12         11         13
1va12cs003  10cs82  s3            12         11         16         14
1va12cs003  10cs83  s3            18         12         10         15
1va13cs004  10cs81  s4            16         12         11         14

USN         SUBCODE SSID       TEST1      TEST2      TEST3    FINALIA
----------- ------- ----- ---------- ---------- ---------- ----------
1va13cs004  10cs82  s4            16         17         18         18

12 rows selected.


5. Categorize students based on the following criterion:
 If FinalIA = 17 to 20 then CAT = ‘Outstanding’ 
If FinalIA = 12 to 16 then CAT = ‘Average’
 If FinalIA< 12 then CAT = ‘Weak’
 Give these details only for 8th semester A, B, and C section students. 


SQL> select s.usn,s.sname,sec.sem,sec.sec,i.subcode,i.finalia,
          case
          when (I.finalia>=17 and i.finalia<=20) then 'outstanding'
          when (i.finalia>=12 and i.finalia<=16) then 'average'
          when (i.finalia<12) then 'weak'
          else 'un_known'
          end cat
          from student s,iamarks i,semsec sec
          where s.usn=i.usn and i.ssid=sec.ssid and sec.sem=8 and sec.sec in('a','b','c')
          order by cat;

USN         SNAME                       SEM SEC   SUBCODE    FINALIA CAT
----------- -------------------- ---------- ----- ------- ---------- -----------
1va12cs003  chaithra                      8 b     10cs83          15 average
1va12cs003  chaithra                      8 b     10cs81          13 average
1va12cs003  chaithra                      8 b     10cs82          14 average
1va12cs002  bharath                       8 a     10cs82          16 average
1va13cs004  daniel                        8 c     10cs81          14 average
1va12cs002  bharath                       8 a     10cs81          18 outstanding
1va13cs004  daniel                        8 c     10cs82          18 outstanding
1va12cs002  bharath                       8 a     10cs83          19 outstanding

8 rows selected.



SQL> update iamarks set test1=10,test2=9,test3=8 where usn='1va12cs002' and subcode='10cs81' ;

1 row updated.

SQL>  update iamarks set test1=10,test2=6,test3=7 where usn='1va12cs003' and subcode='10cs83';

1 row updated.

SQL> select *from iamarks;

USN         SUBCODE SSID       TEST1      TEST2      TEST3    FINALIA
----------- ------- ----- ---------- ---------- ---------- ----------
1va12cs001  10cs41  s7            11         15         18         17
1va12cs001  10cs42  s6            13         19         12         16
1bi15cs101  10cs51  s5            19         20         12         20
1bi15cs101  10cs52  s5            12         14         16         15
1va12cs002  10cs81  s2            10          9          8         18
1va12cs002  10cs82  s2            12         16         15         16
1va12cs002  10cs83  s2            16         18         20         19
1va12cs003  10cs81  s3            14         12         11         13
1va12cs003  10cs82  s3            12         11         16         14
1va12cs003  10cs83  s3            10          6          7         15
1va13cs004  10cs81  s4            16         12         11         14

USN         SUBCODE SSID       TEST1      TEST2      TEST3    FINALIA
----------- ------- ----- ---------- ---------- ---------- ----------
1va13cs004  10cs82  s4            16         17         18         18

12 rows selected.

SQL> update iamarks
     set finalia=case
     when (test1<test2 and test1<test3) then ceil((test2+test3)/2)
     when (test2<test1 and test2<test3) then ceil((test1+test3)/2)
     else ceil((test1+test2)/2)
     end;

12 rows updated.

SQL> select *from iamarks;

USN         SUBCODE SSID       TEST1      TEST2      TEST3    FINALIA
----------- ------- ----- ---------- ---------- ---------- ----------
1va12cs001  10cs41  s7            11         15         18         17
1va12cs001  10cs42  s6            13         19         12         16
1bi15cs101  10cs51  s5            19         20         12         20
1bi15cs101  10cs52  s5            12         14         16         15
1va12cs002  10cs81  s2            10          9          8         10
1va12cs002  10cs82  s2            12         16         15         16
1va12cs002  10cs83  s2            16         18         20         19
1va12cs003  10cs81  s3            14         12         11         13
1va12cs003  10cs82  s3            12         11         16         14
1va12cs003  10cs83  s3            10          6          7          9
1va13cs004  10cs81  s4            16         12         11         14

USN         SUBCODE SSID       TEST1      TEST2      TEST3    FINALIA
----------- ------- ----- ---------- ---------- ---------- ----------
1va13cs004  10cs82  s4            16         17         18         18

12 rows selected.


SQL>select s.usn,s.sname,sec.sem,sec.sec,i.subcode,i.finalia,
          case
          when (I.finalia>=17 and i.finalia<=20) then 'outstanding'
          when (i.finalia>=12 and i.finalia<=16) then 'average'
          when (i.finalia<12) then 'weak'
          else 'un_known'
          end cat
          from student s,iamarks i,semsec sec
          where s.usn=i.usn and i.ssid=sec.ssid and sec.sem=8 and sec.sec in('a','b','c')
          order by cat;

USN         SNAME                       SEM SEC   SUBCODE    FINALIA CAT
----------- -------------------- ---------- ----- ------- ---------- -----------
1va12cs002  bharath                       8 a     10cs82          16 average
1va13cs004  daniel                        8 c     10cs81          14 average
1va12cs003  chaithra                      8 b     10cs82          14 average
1va12cs003  chaithra                      8 b     10cs81          13 average
1va13cs004  daniel                        8 c     10cs82          18 outstanding
1va12cs002  bharath                       8 a     10cs83          19 outstanding
1va12cs002  bharath                       8 a     10cs81          10 weak
1va12cs003  chaithra                      8 b     10cs83           9 weak

8 rows selected.